{
  "codigo": "CPU-DREN-CORPO-BSTC-120-PA2",
  "descricao": "CORPO DE BSTC D = 1,20 M PA2 - AREIA, BRITA E PEDRA DE MÃO COMERCIAIS",
  "unidade": "m",
  "origem": "PROPRIA",
  "categoria": "DRENAGEM",
  "composicao_itens": [
    {
      "insumo_id": "MA-AGIS-CPU-DREN-CORPO-BSTC-120-PA2",
      "coeficiente": 1.0,
      "categoria_custo": "MATERIAL"
    }
  ],
  "custo_direto_unitario_planilha": 3245.799247,
  "precos_unitarios_sbdi": {
    "mo": 0.0,
    "equipamentos": 462.933333,
    "diesel": 156.58496,
    "material": 0.0,
    "total": 619.518293
  },
  "producao_id_ref": "CPU-DREN-CORPO-BSTC-120-PA2-PROD-001"
}